{
  "$defs": {
    "digest": {
      "pattern": "^sha256:[0-9a-f]{64}$",
      "type": "string"
    },
    "sha": {
      "pattern": "^[0-9a-f]{40}$",
      "type": "string"
    },
    "tagName": {
      "pattern": "^v(0|[1-9][0-9]*)\\.(0|[1-9][0-9]*)\\.(0|[1-9][0-9]*)$",
      "type": "string"
    }
  },
  "$id": "https://snaraj.dev/schemas/platform-release-identity/v4",
  "$schema": "https://json-schema.org/draft/2020-12/schema",
  "additionalProperties": false,
  "properties": {
    "changelog": {
      "additionalProperties": false,
      "properties": {
        "fragment_path": {
          "pattern": "^changelog\\.d/[1-9][0-9]*-[a-z0-9]+(?:-[a-z0-9]+)*\\.md$",
          "type": "string"
        },
        "fragment_sha256": {
          "$ref": "#/$defs/digest"
        }
      },
      "required": [
        "fragment_path",
        "fragment_sha256"
      ],
      "type": "object"
    },
    "execution": {
      "additionalProperties": false,
      "properties": {
        "main_ci": {
          "$ref": "#/properties/main_ci"
        },
        "source_sha": {
          "$ref": "#/$defs/sha"
        },
        "tree_sha": {
          "$ref": "#/$defs/sha"
        }
      },
      "required": [
        "source_sha",
        "tree_sha",
        "main_ci"
      ],
      "type": "object"
    },
    "main_ci": {
      "additionalProperties": false,
      "properties": {
        "conclusion": {
          "const": "success"
        },
        "event": {
          "const": "push"
        },
        "head_sha": {
          "$ref": "#/$defs/sha"
        },
        "ref": {
          "const": "refs/heads/main"
        },
        "run_attempt": {
          "minimum": 1,
          "type": "integer"
        },
        "run_id": {
          "minimum": 1,
          "type": "integer"
        },
        "workflow": {
          "const": ".github/workflows/pull-request.yml"
        }
      },
      "required": [
        "conclusion",
        "event",
        "head_sha",
        "ref",
        "run_attempt",
        "run_id",
        "workflow"
      ],
      "type": "object"
    },
    "platform_release": {
      "additionalProperties": false,
      "properties": {
        "event": {
          "enum": [
            "workflow_run",
            "workflow_dispatch"
          ]
        },
        "head_sha": {
          "$ref": "#/$defs/sha"
        },
        "ref": {
          "const": "refs/heads/main"
        },
        "run_attempt": {
          "minimum": 1,
          "type": "integer"
        },
        "run_id": {
          "minimum": 1,
          "type": "integer"
        },
        "workflow": {
          "enum": [
            ".github/workflows/platform-release.yml",
            ".github/workflows/platform-release-recovery.yml"
          ]
        }
      },
      "required": [
        "event",
        "head_sha",
        "ref",
        "run_attempt",
        "run_id",
        "workflow"
      ],
      "type": "object"
    },
    "predecessor": {
      "additionalProperties": false,
      "properties": {
        "peeled_commit": {
          "$ref": "#/$defs/sha"
        },
        "tag": {
          "$ref": "#/$defs/tagName"
        }
      },
      "required": [
        "peeled_commit",
        "tag"
      ],
      "type": "object"
    },
    "release": {
      "additionalProperties": false,
      "properties": {
        "asset_count": {
          "const": 2
        },
        "draft": {
          "const": false
        },
        "id": {
          "minimum": 1,
          "type": "integer"
        },
        "immutable": {
          "const": true
        },
        "prerelease": {
          "const": false
        },
        "tag_name": {
          "$ref": "#/$defs/tagName"
        },
        "target_commitish": {
          "oneOf": [
            {
              "$ref": "#/$defs/sha"
            },
            {
              "const": "main"
            }
          ]
        }
      },
      "required": [
        "asset_count",
        "draft",
        "id",
        "immutable",
        "prerelease",
        "tag_name",
        "target_commitish"
      ],
      "type": "object"
    },
    "repository": {
      "const": "snaraj/platform"
    },
    "repository_id": {
      "const": 1327645656
    },
    "schema": {
      "const": "https://snaraj.dev/schemas/platform-release-identity/v4"
    },
    "source": {
      "additionalProperties": false,
      "properties": {
        "merge_sha": {
          "$ref": "#/$defs/sha"
        },
        "protected_ref": {
          "const": "refs/heads/main"
        },
        "tree_sha": {
          "$ref": "#/$defs/sha"
        }
      },
      "required": [
        "merge_sha",
        "protected_ref",
        "tree_sha"
      ],
      "type": "object"
    },
    "tag": {
      "additionalProperties": false,
      "properties": {
        "name": {
          "$ref": "#/$defs/tagName"
        },
        "object_sha": {
          "$ref": "#/$defs/sha"
        },
        "object_type": {
          "const": "tag"
        },
        "peeled_commit": {
          "$ref": "#/$defs/sha"
        }
      },
      "required": [
        "name",
        "object_sha",
        "object_type",
        "peeled_commit"
      ],
      "type": "object"
    }
  },
  "required": [
    "changelog",
    "main_ci",
    "platform_release",
    "predecessor",
    "release",
    "repository",
    "repository_id",
    "schema",
    "source",
    "tag",
    "execution"
  ],
  "type": "object"
}
