{"changelog":{"fragment_path":"changelog.d/383-boot-time-recovery.md","fragment_sha256":"sha256:cddfa8066293d4247cca4f5af7bdffad21e93ef068f3dfce23d9ac567ff4606b"},"execution":{"main_ci":{"conclusion":"success","event":"push","head_sha":"62f6ec1a51916e22956b72504e28a2932ee4b573","ref":"refs/heads/main","run_attempt":1,"run_id":35808376272,"workflow":".github/workflows/pull-request.yml"},"source_sha":"62f6ec1a51916e22956b72504e28a2932ee4b573","tree_sha":"de54fbb6b565b37b338e7d6dc55d59400d35c678"},"main_ci":{"conclusion":"success","event":"push","head_sha":"54ac82e692fa11999fafde52f2f4fe6ea17b47b5","ref":"refs/heads/main","run_attempt":1,"run_id":35548047591,"workflow":".github/workflows/pull-request.yml"},"platform_release":{"event":"workflow_dispatch","head_sha":"62f6ec1a51916e22956b72504e28a2932ee4b573","ref":"refs/heads/main","run_attempt":1,"run_id":35813249508,"workflow":".github/workflows/platform-release-recovery.yml"},"predecessor":{"peeled_commit":"2a597ce999979ae463bc575eb63d6d7d5a2a182d","tag":"v0.1.89"},"release":{"asset_count":2,"draft":false,"id":394272505,"immutable":true,"prerelease":false,"tag_name":"v0.1.90","target_commitish":"main"},"repository":"snaraj/platform","repository_id":1327645656,"schema":"https://snaraj.dev/schemas/platform-release-identity/v4","source":{"merge_sha":"54ac82e692fa11999fafde52f2f4fe6ea17b47b5","protected_ref":"refs/heads/main","tree_sha":"200afeca74abe21a6f13d6d0076f690a790abe84"},"tag":{"name":"v0.1.90","object_sha":"0083e8541e9df23298e8671fdb1047f8644c821c","object_type":"tag","peeled_commit":"54ac82e692fa11999fafde52f2f4fe6ea17b47b5"}}
