{"changelog":{"fragment_path":"changelog.d/367-reserved-file-storage.md","fragment_sha256":"sha256:90e877f38e58ff5e7c7caa564bc2606c2c7138229b544a59c200ba24154e8009"},"execution":{"main_ci":{"conclusion":"success","event":"push","head_sha":"76f60b306d028f5a2febcbf7b35c8ab16b0dd139","ref":"refs/heads/main","run_attempt":1,"run_id":35788330613,"workflow":".github/workflows/pull-request.yml"},"source_sha":"76f60b306d028f5a2febcbf7b35c8ab16b0dd139","tree_sha":"8123906d6d4330ed69c175038fe472fbd9d285dd"},"main_ci":{"conclusion":"success","event":"push","head_sha":"3b7a0532ba5fe2f10037023f3e26ec5876f8d191","ref":"refs/heads/main","run_attempt":1,"run_id":34638257426,"workflow":".github/workflows/pull-request.yml"},"platform_release":{"event":"workflow_dispatch","head_sha":"76f60b306d028f5a2febcbf7b35c8ab16b0dd139","ref":"refs/heads/main","run_attempt":1,"run_id":35790743272,"workflow":".github/workflows/platform-release-recovery.yml"},"predecessor":{"peeled_commit":"9cd79f1e69cfa00eb5467822831056101629c8f8","tag":"v0.1.82"},"release":{"asset_count":2,"draft":false,"id":394157866,"immutable":true,"prerelease":false,"tag_name":"v0.1.83","target_commitish":"main"},"repository":"snaraj/platform","repository_id":1327645656,"schema":"https://snaraj.dev/schemas/platform-release-identity/v4","source":{"merge_sha":"3b7a0532ba5fe2f10037023f3e26ec5876f8d191","protected_ref":"refs/heads/main","tree_sha":"012b386dacf8dcffde5a78dba9af2897d229859d"},"tag":{"name":"v0.1.83","object_sha":"871ba1555c4d6049d7bf348966f5513eb2989b7b","object_type":"tag","peeled_commit":"3b7a0532ba5fe2f10037023f3e26ec5876f8d191"}}
