{"changelog":{"fragment_path":"changelog.d/362-obsync-private-boundary.md","fragment_sha256":"sha256:efcf3d946e417320cc7d75f724cc862470571946cfe5fa760404a240cd150df1"},"execution":{"main_ci":{"conclusion":"success","event":"push","head_sha":"10ee0a67144675630456daafeb002755aba653d4","ref":"refs/heads/main","run_attempt":1,"run_id":35684876122,"workflow":".github/workflows/pull-request.yml"},"source_sha":"10ee0a67144675630456daafeb002755aba653d4","tree_sha":"e482a6be62d2d63042d6f0dbadbbfd00b6e30ac0"},"main_ci":{"conclusion":"success","event":"push","head_sha":"060c9678e130487b27cdaec395b0f1c5d74b9240","ref":"refs/heads/main","run_attempt":1,"run_id":34283118915,"workflow":".github/workflows/pull-request.yml"},"platform_release":{"event":"workflow_dispatch","head_sha":"10ee0a67144675630456daafeb002755aba653d4","ref":"refs/heads/main","run_attempt":1,"run_id":35747448100,"workflow":".github/workflows/platform-release-recovery.yml"},"predecessor":{"peeled_commit":"4f9b29339fec6ff06b37ecc0024b48cbe857f96f","tag":"v0.1.80"},"release":{"asset_count":2,"draft":false,"id":387789735,"immutable":true,"prerelease":false,"tag_name":"v0.1.81","target_commitish":"main"},"repository":"snaraj/platform","repository_id":1327645656,"schema":"https://snaraj.dev/schemas/platform-release-identity/v4","source":{"merge_sha":"060c9678e130487b27cdaec395b0f1c5d74b9240","protected_ref":"refs/heads/main","tree_sha":"3ff155f933aba5e0e528d1f30a36357968031917"},"tag":{"name":"v0.1.81","object_sha":"f5625bf149c2de4bb376e0377f8b1c0536dcc6b3","object_type":"tag","peeled_commit":"060c9678e130487b27cdaec395b0f1c5d74b9240"}}
