{"changelog":{"fragment_path":"changelog.d/387-codeql-4-38-1.md","fragment_sha256":"sha256:d02324260af2ef59e179e9ac65e62eaa852ab2be1ecd934576bb67fa8ed3ae89"},"execution":{"main_ci":{"conclusion":"success","event":"push","head_sha":"62f6ec1a51916e22956b72504e28a2932ee4b573","ref":"refs/heads/main","run_attempt":1,"run_id":35808376272,"workflow":".github/workflows/pull-request.yml"},"source_sha":"62f6ec1a51916e22956b72504e28a2932ee4b573","tree_sha":"de54fbb6b565b37b338e7d6dc55d59400d35c678"},"main_ci":{"conclusion":"success","event":"push","head_sha":"10ee0a67144675630456daafeb002755aba653d4","ref":"refs/heads/main","run_attempt":1,"run_id":35684876122,"workflow":".github/workflows/pull-request.yml"},"platform_release":{"event":"workflow_dispatch","head_sha":"62f6ec1a51916e22956b72504e28a2932ee4b573","ref":"refs/heads/main","run_attempt":1,"run_id":35814065606,"workflow":".github/workflows/platform-release-recovery.yml"},"predecessor":{"peeled_commit":"54ac82e692fa11999fafde52f2f4fe6ea17b47b5","tag":"v0.1.90"},"release":{"asset_count":2,"draft":false,"id":394276899,"immutable":true,"prerelease":false,"tag_name":"v0.1.91","target_commitish":"main"},"repository":"snaraj/platform","repository_id":1327645656,"schema":"https://snaraj.dev/schemas/platform-release-identity/v4","source":{"merge_sha":"10ee0a67144675630456daafeb002755aba653d4","protected_ref":"refs/heads/main","tree_sha":"e482a6be62d2d63042d6f0dbadbbfd00b6e30ac0"},"tag":{"name":"v0.1.91","object_sha":"6c3d3a4802ca7542ab4a6901e68f298454d42e58","object_type":"tag","peeled_commit":"10ee0a67144675630456daafeb002755aba653d4"}}
