{"changelog":{"fragment_path":"changelog.d/391-frozen-executor-pin.md","fragment_sha256":"sha256:f5d909df8b48d03bdae3de3a7dc35fae5885bdba0b7c046837906f6e267c66bf"},"execution":{"main_ci":{"conclusion":"success","event":"push","head_sha":"62f6ec1a51916e22956b72504e28a2932ee4b573","ref":"refs/heads/main","run_attempt":1,"run_id":35808376272,"workflow":".github/workflows/pull-request.yml"},"source_sha":"62f6ec1a51916e22956b72504e28a2932ee4b573","tree_sha":"de54fbb6b565b37b338e7d6dc55d59400d35c678"},"main_ci":{"conclusion":"success","event":"push","head_sha":"76f60b306d028f5a2febcbf7b35c8ab16b0dd139","ref":"refs/heads/main","run_attempt":1,"run_id":35788330613,"workflow":".github/workflows/pull-request.yml"},"platform_release":{"event":"workflow_dispatch","head_sha":"62f6ec1a51916e22956b72504e28a2932ee4b573","ref":"refs/heads/main","run_attempt":1,"run_id":35816627298,"workflow":".github/workflows/platform-release-recovery.yml"},"predecessor":{"peeled_commit":"f71fc1f37f9ca1883e10286a13132cd70a17cf9f","tag":"v0.1.92"},"release":{"asset_count":2,"draft":false,"id":394279891,"immutable":true,"prerelease":false,"tag_name":"v0.1.93","target_commitish":"main"},"repository":"snaraj/platform","repository_id":1327645656,"schema":"https://snaraj.dev/schemas/platform-release-identity/v4","source":{"merge_sha":"76f60b306d028f5a2febcbf7b35c8ab16b0dd139","protected_ref":"refs/heads/main","tree_sha":"8123906d6d4330ed69c175038fe472fbd9d285dd"},"tag":{"name":"v0.1.93","object_sha":"03fa04e7b595ea8c8e6c72cb4597064ac5f0e323","object_type":"tag","peeled_commit":"76f60b306d028f5a2febcbf7b35c8ab16b0dd139"}}
