{"changelog":{"fragment_path":"changelog.d/381-codeql-4-38.md","fragment_sha256":"sha256:648a3b9d793c0ff54f5f01653eba0cb5fa8a787caea3a889e507472b4aaecdbf"},"execution":{"main_ci":{"conclusion":"success","event":"push","head_sha":"76f60b306d028f5a2febcbf7b35c8ab16b0dd139","ref":"refs/heads/main","run_attempt":1,"run_id":35788330613,"workflow":".github/workflows/pull-request.yml"},"source_sha":"76f60b306d028f5a2febcbf7b35c8ab16b0dd139","tree_sha":"8123906d6d4330ed69c175038fe472fbd9d285dd"},"main_ci":{"conclusion":"success","event":"push","head_sha":"2a597ce999979ae463bc575eb63d6d7d5a2a182d","ref":"refs/heads/main","run_attempt":1,"run_id":34932536836,"workflow":".github/workflows/pull-request.yml"},"platform_release":{"event":"workflow_dispatch","head_sha":"76f60b306d028f5a2febcbf7b35c8ab16b0dd139","ref":"refs/heads/main","run_attempt":1,"run_id":35793384370,"workflow":".github/workflows/platform-release-recovery.yml"},"predecessor":{"peeled_commit":"64cc95f3802c8feb8567f9b607aeac5c10d8d830","tag":"v0.1.88"},"release":{"asset_count":2,"draft":false,"id":394168254,"immutable":true,"prerelease":false,"tag_name":"v0.1.89","target_commitish":"main"},"repository":"snaraj/platform","repository_id":1327645656,"schema":"https://snaraj.dev/schemas/platform-release-identity/v4","source":{"merge_sha":"2a597ce999979ae463bc575eb63d6d7d5a2a182d","protected_ref":"refs/heads/main","tree_sha":"9b9d3038c073b4d3a8d25576aaf236693aaead38"},"tag":{"name":"v0.1.89","object_sha":"0ad65a3ff4cdf089fb78a232c679d651078ad31f","object_type":"tag","peeled_commit":"2a597ce999979ae463bc575eb63d6d7d5a2a182d"}}
