{"changelog":{"fragment_path":"changelog.d/371-owner-prepared-recovery-tags.md","fragment_sha256":"sha256:107e8b80a7891bccadec8df0a12c2750b75071dca530d410e9e0b19d96193cb3"},"execution":{"main_ci":{"conclusion":"success","event":"push","head_sha":"76f60b306d028f5a2febcbf7b35c8ab16b0dd139","ref":"refs/heads/main","run_attempt":1,"run_id":35788330613,"workflow":".github/workflows/pull-request.yml"},"source_sha":"76f60b306d028f5a2febcbf7b35c8ab16b0dd139","tree_sha":"8123906d6d4330ed69c175038fe472fbd9d285dd"},"main_ci":{"conclusion":"success","event":"push","head_sha":"2ad053e307e43f6dfb5015de1f1bf09c3505a832","ref":"refs/heads/main","run_attempt":1,"run_id":34673797428,"workflow":".github/workflows/pull-request.yml"},"platform_release":{"event":"workflow_dispatch","head_sha":"76f60b306d028f5a2febcbf7b35c8ab16b0dd139","ref":"refs/heads/main","run_attempt":1,"run_id":35791792985,"workflow":".github/workflows/platform-release-recovery.yml"},"predecessor":{"peeled_commit":"47fc0a1fb573983d69acfc88bcf6f950899f8772","tag":"v0.1.85"},"release":{"asset_count":2,"draft":false,"id":394162468,"immutable":true,"prerelease":false,"tag_name":"v0.1.86","target_commitish":"main"},"repository":"snaraj/platform","repository_id":1327645656,"schema":"https://snaraj.dev/schemas/platform-release-identity/v4","source":{"merge_sha":"2ad053e307e43f6dfb5015de1f1bf09c3505a832","protected_ref":"refs/heads/main","tree_sha":"1be628601c92a07bdc7f2f4dc3140d6d6195770a"},"tag":{"name":"v0.1.86","object_sha":"34a4f47e95f8e95d699ab8b6c26f7be010ded2c9","object_type":"tag","peeled_commit":"2ad053e307e43f6dfb5015de1f1bf09c3505a832"}}
