{"changelog":{"fragment_path":"changelog.d/377-private-connector-artifact.md","fragment_sha256":"sha256:5a0507eed2a61a086d00e24ff5ec5921091081b3988fcfcad48a0d3dd89aabd3"},"execution":{"main_ci":{"conclusion":"success","event":"push","head_sha":"76f60b306d028f5a2febcbf7b35c8ab16b0dd139","ref":"refs/heads/main","run_attempt":1,"run_id":35788330613,"workflow":".github/workflows/pull-request.yml"},"source_sha":"76f60b306d028f5a2febcbf7b35c8ab16b0dd139","tree_sha":"8123906d6d4330ed69c175038fe472fbd9d285dd"},"main_ci":{"conclusion":"success","event":"push","head_sha":"57a8807d551f19b13ee9e2caea398dbaa280296f","ref":"refs/heads/main","run_attempt":1,"run_id":34732230714,"workflow":".github/workflows/pull-request.yml"},"platform_release":{"event":"workflow_dispatch","head_sha":"76f60b306d028f5a2febcbf7b35c8ab16b0dd139","ref":"refs/heads/main","run_attempt":1,"run_id":35792141493,"workflow":".github/workflows/platform-release-recovery.yml"},"predecessor":{"peeled_commit":"2ad053e307e43f6dfb5015de1f1bf09c3505a832","tag":"v0.1.86"},"release":{"asset_count":2,"draft":false,"id":394164673,"immutable":true,"prerelease":false,"tag_name":"v0.1.87","target_commitish":"main"},"repository":"snaraj/platform","repository_id":1327645656,"schema":"https://snaraj.dev/schemas/platform-release-identity/v4","source":{"merge_sha":"57a8807d551f19b13ee9e2caea398dbaa280296f","protected_ref":"refs/heads/main","tree_sha":"4d8933576c5112867c0f3665ffa997321619252f"},"tag":{"name":"v0.1.87","object_sha":"4e8b762ef2a6d866cfbd9be97517f8f924783789","object_type":"tag","peeled_commit":"57a8807d551f19b13ee9e2caea398dbaa280296f"}}
