{"changelog":{"fragment_path":"changelog.d/393-recovery-read-budget.md","fragment_sha256":"sha256:83e3ea160bf09f3c5c66d1d186f5c6379cee65708aee35ae65f4d6b92ec70cdb"},"execution":{"main_ci":{"conclusion":"success","event":"push","head_sha":"62f6ec1a51916e22956b72504e28a2932ee4b573","ref":"refs/heads/main","run_attempt":1,"run_id":35808376272,"workflow":".github/workflows/pull-request.yml"},"source_sha":"62f6ec1a51916e22956b72504e28a2932ee4b573","tree_sha":"de54fbb6b565b37b338e7d6dc55d59400d35c678"},"main_ci":{"conclusion":"success","event":"push","head_sha":"62f6ec1a51916e22956b72504e28a2932ee4b573","ref":"refs/heads/main","run_attempt":1,"run_id":35808376272,"workflow":".github/workflows/pull-request.yml"},"platform_release":{"event":"workflow_run","head_sha":"62f6ec1a51916e22956b72504e28a2932ee4b573","ref":"refs/heads/main","run_attempt":3,"run_id":35808566321,"workflow":".github/workflows/platform-release.yml"},"predecessor":{"peeled_commit":"76f60b306d028f5a2febcbf7b35c8ab16b0dd139","tag":"v0.1.93"},"release":{"asset_count":2,"draft":false,"id":394322192,"immutable":true,"prerelease":false,"tag_name":"v0.1.94","target_commitish":"62f6ec1a51916e22956b72504e28a2932ee4b573"},"repository":"snaraj/platform","repository_id":1327645656,"schema":"https://snaraj.dev/schemas/platform-release-identity/v4","source":{"merge_sha":"62f6ec1a51916e22956b72504e28a2932ee4b573","protected_ref":"refs/heads/main","tree_sha":"de54fbb6b565b37b338e7d6dc55d59400d35c678"},"tag":{"name":"v0.1.94","object_sha":"cc88f76d8c0a6321d6c2fc15ebd4f033bfc26f0f","object_type":"tag","peeled_commit":"62f6ec1a51916e22956b72504e28a2932ee4b573"}}
