{"changelog":{"fragment_path":"changelog.d/373-reserved-evidence.md","fragment_sha256":"sha256:7bc29a7dae92fe311ffa0ce9f27428e5929da830758025d24a09a6a7c73fbc8d"},"execution":{"main_ci":{"conclusion":"success","event":"push","head_sha":"76f60b306d028f5a2febcbf7b35c8ab16b0dd139","ref":"refs/heads/main","run_attempt":1,"run_id":35788330613,"workflow":".github/workflows/pull-request.yml"},"source_sha":"76f60b306d028f5a2febcbf7b35c8ab16b0dd139","tree_sha":"8123906d6d4330ed69c175038fe472fbd9d285dd"},"main_ci":{"conclusion":"success","event":"push","head_sha":"47fc0a1fb573983d69acfc88bcf6f950899f8772","ref":"refs/heads/main","run_attempt":1,"run_id":34667651399,"workflow":".github/workflows/pull-request.yml"},"platform_release":{"event":"workflow_dispatch","head_sha":"76f60b306d028f5a2febcbf7b35c8ab16b0dd139","ref":"refs/heads/main","run_attempt":1,"run_id":35791453634,"workflow":".github/workflows/platform-release-recovery.yml"},"predecessor":{"peeled_commit":"bb9a8d7a45f761491a4e17fffdc79a22e87c6dd4","tag":"v0.1.84"},"release":{"asset_count":2,"draft":false,"id":394161048,"immutable":true,"prerelease":false,"tag_name":"v0.1.85","target_commitish":"main"},"repository":"snaraj/platform","repository_id":1327645656,"schema":"https://snaraj.dev/schemas/platform-release-identity/v4","source":{"merge_sha":"47fc0a1fb573983d69acfc88bcf6f950899f8772","protected_ref":"refs/heads/main","tree_sha":"80ae88a405c8aded3f65455e42e980e2138923f0"},"tag":{"name":"v0.1.85","object_sha":"baa2028d9f383314bc078305efb133e54ee8b6b6","object_type":"tag","peeled_commit":"47fc0a1fb573983d69acfc88bcf6f950899f8772"}}
