{"changelog":{"fragment_path":"changelog.d/317-release-backlog-automation.md","fragment_sha256":"sha256:1d0cd44be2be75974f003da46df4116f8fd1461569164e45de4e4b9cb53ada58"},"execution":{"main_ci":{"conclusion":"success","event":"push","head_sha":"62f6ec1a51916e22956b72504e28a2932ee4b573","ref":"refs/heads/main","run_attempt":1,"run_id":35808376272,"workflow":".github/workflows/pull-request.yml"},"source_sha":"62f6ec1a51916e22956b72504e28a2932ee4b573","tree_sha":"de54fbb6b565b37b338e7d6dc55d59400d35c678"},"main_ci":{"conclusion":"success","event":"push","head_sha":"f71fc1f37f9ca1883e10286a13132cd70a17cf9f","ref":"refs/heads/main","run_attempt":1,"run_id":35773664240,"workflow":".github/workflows/pull-request.yml"},"platform_release":{"event":"workflow_dispatch","head_sha":"62f6ec1a51916e22956b72504e28a2932ee4b573","ref":"refs/heads/main","run_attempt":1,"run_id":35814364108,"workflow":".github/workflows/platform-release-recovery.yml"},"predecessor":{"peeled_commit":"10ee0a67144675630456daafeb002755aba653d4","tag":"v0.1.91"},"release":{"asset_count":2,"draft":false,"id":394278457,"immutable":true,"prerelease":false,"tag_name":"v0.1.92","target_commitish":"main"},"repository":"snaraj/platform","repository_id":1327645656,"schema":"https://snaraj.dev/schemas/platform-release-identity/v4","source":{"merge_sha":"f71fc1f37f9ca1883e10286a13132cd70a17cf9f","protected_ref":"refs/heads/main","tree_sha":"3b1b144a12247006cb0ef065e1e2f1d4fe3d040b"},"tag":{"name":"v0.1.92","object_sha":"ede104329df84fe899b64af96ef635ae15f35ee1","object_type":"tag","peeled_commit":"f71fc1f37f9ca1883e10286a13132cd70a17cf9f"}}
