{"changelog":{"fragment_path":"changelog.d/369-source-recovery.md","fragment_sha256":"sha256:02e4911286c2d5e4f5660ea8e833d9080c8323291bd697d7da8e1b91c6140a8d"},"execution":{"main_ci":{"conclusion":"success","event":"push","head_sha":"76f60b306d028f5a2febcbf7b35c8ab16b0dd139","ref":"refs/heads/main","run_attempt":1,"run_id":35788330613,"workflow":".github/workflows/pull-request.yml"},"source_sha":"76f60b306d028f5a2febcbf7b35c8ab16b0dd139","tree_sha":"8123906d6d4330ed69c175038fe472fbd9d285dd"},"main_ci":{"conclusion":"success","event":"push","head_sha":"bb9a8d7a45f761491a4e17fffdc79a22e87c6dd4","ref":"refs/heads/main","run_attempt":1,"run_id":34661250611,"workflow":".github/workflows/pull-request.yml"},"platform_release":{"event":"workflow_dispatch","head_sha":"76f60b306d028f5a2febcbf7b35c8ab16b0dd139","ref":"refs/heads/main","run_attempt":1,"run_id":35791114753,"workflow":".github/workflows/platform-release-recovery.yml"},"predecessor":{"peeled_commit":"3b7a0532ba5fe2f10037023f3e26ec5876f8d191","tag":"v0.1.83"},"release":{"asset_count":2,"draft":false,"id":394159524,"immutable":true,"prerelease":false,"tag_name":"v0.1.84","target_commitish":"main"},"repository":"snaraj/platform","repository_id":1327645656,"schema":"https://snaraj.dev/schemas/platform-release-identity/v4","source":{"merge_sha":"bb9a8d7a45f761491a4e17fffdc79a22e87c6dd4","protected_ref":"refs/heads/main","tree_sha":"ab5a09071ae145f0ad733039b6cad7dd8bb9edf5"},"tag":{"name":"v0.1.84","object_sha":"84ff69bffb044d209cef4c89aa5f4c4dc5713bbb","object_type":"tag","peeled_commit":"bb9a8d7a45f761491a4e17fffdc79a22e87c6dd4"}}
