{"changelog":{"fragment_path":"changelog.d/365-obsync-staged-readiness.md","fragment_sha256":"sha256:546e5ad23459bd53a94b768668e1faa09ff1500fc1a34b5bf03d98a521d9b44a"},"execution":{"main_ci":{"conclusion":"success","event":"push","head_sha":"76f60b306d028f5a2febcbf7b35c8ab16b0dd139","ref":"refs/heads/main","run_attempt":1,"run_id":35788330613,"workflow":".github/workflows/pull-request.yml"},"source_sha":"76f60b306d028f5a2febcbf7b35c8ab16b0dd139","tree_sha":"8123906d6d4330ed69c175038fe472fbd9d285dd"},"main_ci":{"conclusion":"success","event":"push","head_sha":"9cd79f1e69cfa00eb5467822831056101629c8f8","ref":"refs/heads/main","run_attempt":1,"run_id":34305321734,"workflow":".github/workflows/pull-request.yml"},"platform_release":{"event":"workflow_dispatch","head_sha":"76f60b306d028f5a2febcbf7b35c8ab16b0dd139","ref":"refs/heads/main","run_attempt":1,"run_id":35790366605,"workflow":".github/workflows/platform-release-recovery.yml"},"predecessor":{"peeled_commit":"060c9678e130487b27cdaec395b0f1c5d74b9240","tag":"v0.1.81"},"release":{"asset_count":2,"draft":false,"id":394156049,"immutable":true,"prerelease":false,"tag_name":"v0.1.82","target_commitish":"main"},"repository":"snaraj/platform","repository_id":1327645656,"schema":"https://snaraj.dev/schemas/platform-release-identity/v4","source":{"merge_sha":"9cd79f1e69cfa00eb5467822831056101629c8f8","protected_ref":"refs/heads/main","tree_sha":"360078458d75927170d39c176479d14af0a58928"},"tag":{"name":"v0.1.82","object_sha":"5fcc8d3a43714dd9692e39c21035cb0efe88115c","object_type":"tag","peeled_commit":"9cd79f1e69cfa00eb5467822831056101629c8f8"}}
