{"changelog":{"fragment_path":"changelog.d/379-release-draft-tags.md","fragment_sha256":"sha256:92fbe046f3337db42a7023fa9756ef7d56c9e4afed314c92e80711a99cc973b2"},"execution":{"main_ci":{"conclusion":"success","event":"push","head_sha":"76f60b306d028f5a2febcbf7b35c8ab16b0dd139","ref":"refs/heads/main","run_attempt":1,"run_id":35788330613,"workflow":".github/workflows/pull-request.yml"},"source_sha":"76f60b306d028f5a2febcbf7b35c8ab16b0dd139","tree_sha":"8123906d6d4330ed69c175038fe472fbd9d285dd"},"main_ci":{"conclusion":"success","event":"push","head_sha":"64cc95f3802c8feb8567f9b607aeac5c10d8d830","ref":"refs/heads/main","run_attempt":1,"run_id":34789838965,"workflow":".github/workflows/pull-request.yml"},"platform_release":{"event":"workflow_dispatch","head_sha":"76f60b306d028f5a2febcbf7b35c8ab16b0dd139","ref":"refs/heads/main","run_attempt":1,"run_id":35792524854,"workflow":".github/workflows/platform-release-recovery.yml"},"predecessor":{"peeled_commit":"57a8807d551f19b13ee9e2caea398dbaa280296f","tag":"v0.1.87"},"release":{"asset_count":2,"draft":false,"id":394166552,"immutable":true,"prerelease":false,"tag_name":"v0.1.88","target_commitish":"main"},"repository":"snaraj/platform","repository_id":1327645656,"schema":"https://snaraj.dev/schemas/platform-release-identity/v4","source":{"merge_sha":"64cc95f3802c8feb8567f9b607aeac5c10d8d830","protected_ref":"refs/heads/main","tree_sha":"b5fd892756aad9c7dade17e985fcc3f25bffa585"},"tag":{"name":"v0.1.88","object_sha":"b56a4aaac6ec352587053a65114b584a350368bd","object_type":"tag","peeled_commit":"64cc95f3802c8feb8567f9b607aeac5c10d8d830"}}
